{
  "experiment_id": "EXP-571",
  "issue_number": 571,
  "reproducibility_status": "INFERENCE_VERIFIED",
  "source_commit": "ea211379af6486d46636f96afa6e4af027504e05",
  "source_tag": null,
  "dirty_worktree": false,
  "data_manifest": "reproducibility/exp571_data_centric_features_parser_v4_base/data_manifest.json",
  "environment": "reproducibility/exp571_data_centric_features_parser_v4_base/environment.json",
  "release_url": null,
  "verifier": "Gomin-art",
  "verified_at": "2026-08-06T04:58:57.589164+00:00",
  "artifacts": [
    {
      "kind": "checkpoint",
      "path": "models/exp571_data_centric_features_parser_v4_base/fold_00.txt",
      "size_bytes": 8162774,
      "sha256": "1664d59d76d4aec204ef2841b435259f7c378166e237b4e1a01cb05d10683fde",
      "storage_uri": null
    },
    {
      "kind": "checkpoint",
      "path": "models/exp571_data_centric_features_parser_v4_base/fold_01.txt",
      "size_bytes": 5497069,
      "sha256": "b0e03ce65fd65f1d4cf6fbf32a78071306a438b6046defd03b456562cf9ae191",
      "storage_uri": null
    },
    {
      "kind": "checkpoint",
      "path": "models/exp571_data_centric_features_parser_v4_base/fold_02.txt",
      "size_bytes": 8206873,
      "sha256": "3ff0cae017975d24d18aeab6a7eb0437c8fed7d53af94f8689f3822b9375aa1e",
      "storage_uri": null
    },
    {
      "kind": "checkpoint",
      "path": "models/exp571_data_centric_features_parser_v4_base/fold_03.txt",
      "size_bytes": 14789795,
      "sha256": "dc5d14604b9ea7ff291cd878e1654831d8758b323a07a73dcf3f53d4be34c99f",
      "storage_uri": null
    },
    {
      "kind": "checkpoint",
      "path": "models/exp571_data_centric_features_parser_v4_base/fold_04.txt",
      "size_bytes": 5590150,
      "sha256": "f01a56f32159895587c46b17b9eead3fb2d8a3e3f74e0bcc810fcc0623296e21",
      "storage_uri": null
    },
    {
      "kind": "oof_probability",
      "path": "oof/exp571_data_centric_features_parser_v4_base.csv",
      "size_bytes": 3501997,
      "sha256": "3bffaa23feba0caec49f00e6c708cfad5c3194e2fa292680bc4e92c1acc25a66",
      "storage_uri": null
    },
    {
      "kind": "test_probability",
      "path": "preds/exp571_data_centric_features_parser_v4_base_test_proba.csv",
      "size_bytes": 1398762,
      "sha256": "0f4e1b8e9c59feb9d885d31a17211cfeeb5e6c101aa486da8aaac48ef0c3a9c5",
      "storage_uri": null
    },
    {
      "kind": "submission",
      "path": "submissions/exp571_data_centric_features_parser_v4_base.csv",
      "size_bytes": 38258,
      "sha256": "5ee47c89232ab6f449a504bee907fbfcd2c4b42ea7b347752a0b6ec2a5130c96",
      "storage_uri": null
    },
    {
      "kind": "metrics",
      "path": "reports/exp571_data_centric_features_parser_v4_base/metrics.json",
      "size_bytes": 11523,
      "sha256": "6c92b2afa81f129ab1ad952001c2a4e1e993a1103c685f23cdb2cdc3c7c2e2d3",
      "storage_uri": null
    },
    {
      "kind": "resolved_config",
      "path": "reproducibility/exp571_data_centric_features_parser_v4_base/config.resolved.yaml",
      "size_bytes": 6879,
      "sha256": "832e74e1f73b67f145bcf1d73c8376d9a74a5e699e2e2c2a195943e1ded47b4b",
      "storage_uri": null
    }
  ],
  "verification": {
    "data_hashes_match": true,
    "submission_sha256_match": true,
    "test_label_agreement": 1.0,
    "probability_atol": 1e-06,
    "probability_rtol": 1e-06,
    "passed": true
  }
}
